{
  "schema_version": 1,
  "research_inputs": [{"id":"broad-audit","filename":"Pasted markdown(6).md","sha256":"73677e4c5f1509365f7d873c59628ce9290e576af2b480a4ece0b11ae6842e74","notes":"Local AI Harness Capability Expansion Audit, 2026-10-21. Claims were not local execution tests; citation URLs absent in supplied Markdown."},{"id":"emerging-audit","filename":"Pasted text (2)(2).txt","sha256":"f157d856cb230bf3cad3bec82a022e5b1e4260e5ef0b8ef2feb8ecd901bbd468","notes":"Emerging projects audit, cutoff 2026-10-21 19:41 CEST. Repository/source audit, not Windows execution."}],
  "sources": [
    {"id":"rea-rankings","kind":"json","role":"discovery","url":"https://miles990.github.io/rea-case-rankings/api/records.json","enabled":true,"tool":null,"notes":"Discovery scores are not verification."},
    {"id":"rea-daily","kind":"json","role":"discovery","url":"https://miles990.github.io/rea-case-rankings/api/daily.json","enabled":false,"tool":null,"notes":"Optional alternative to full records; enable or select explicitly."},
    {"id":"rea-rss","kind":"rss","role":"discovery","url":"https://miles990.github.io/rea-case-rankings/feed.xml","enabled":false,"tool":null,"notes":"Optional RSS alternative."},
    {"id":"awesome-reverse-engineered","kind":"json","role":"discovery","url":"https://raw.githubusercontent.com/alexgaoth/awesome-reverse-engineered/main/data/entries.json","enabled":true,"tool":null,"notes":"Live JSON retrieved this run; the broad audit reported it unreachable."},
    {"id":"rea-list","kind":"markdown","role":"discovery","url":"https://raw.githubusercontent.com/AIshihzong/awesome-reverse-engineer-anything/main/README.md","enabled":true,"tool":null,"notes":"Follow project links to original repositories."},
    {"id":"rea-cases","kind":"markdown","role":"discovery","url":"https://raw.githubusercontent.com/songshikang0111/awesome-REA-cases/main/INDEX.en.md","enabled":true,"tool":null,"notes":"Full index rather than maintenance-commit counts."},
    {"id":"glama","kind":"json","role":"discovery","url":"https://glama.ai/api/mcp/v1/servers?first=50&sort=added-at%3Adesc","enabled":false,"tool":null,"notes":"API requires authentication (401 observed). No credentials loaded. Use manual directory review until a separate authorized adapter exists."},
    {"id":"rea-npm","kind":"npm","role":"release","url":"https://registry.npmjs.org/rea-agents/latest","enabled":true,"tool":"rea","notes":"Package version is separate from repository release and source verification."},
    {"id":"logisheets-npm","kind":"npm","role":"release","url":"https://registry.npmjs.org/logisheets/latest","enabled":true,"tool":"logisheets","notes":"Compare package/source versions before adoption."},
    {"id":"audacity-pypi","kind":"pypi","role":"release","url":"https://pypi.org/pypi/audacity-mcp-server/json","enabled":false,"tool":"audacity-file-mcp","notes":"Report references this package; publishing identity and mapping to this repository need verification."}
  ],
  "tools": [
    {
      "id": "rea",
      "name": "REA + Ghidra",
      "repository": "https://github.com/morluto/rea",
      "discovered_at": "2026-10-21T20:51:48Z",
      "discovery_sources": ["broad-audit"],
      "repository_created_at": null,
      "first_public_commit_at": null,
      "latest_functional_commit_at": null,
      "latest_release": {"version":null,"published_at":null},
      "upstream_or_parent": null,
      "license": "MIT",
      "windows": {"build":true,"execution":null},
      "interfaces": {"cli":true,"mcp":true,"stdio":null,"json_rpc":null,"headless":null,"live_gui_attach":null},
      "agent_properties": {"inspectable_state":true,"render_feedback":null,"filesystem_scoping":null,"revision_guards":null,"rollback":null,"transactional_edits":null},
      "security": {"boundaries":["Dedicated static-analysis copies; Ghidra is the provider."],"concerns":["Providers and hostile targets require separate evaluation."]},
      "capability": {"category":"reverse engineering","replaces":[],"incremental_value":"Binary, Electron and runtime evidence beyond source-code agents.","existing_routes":["shell","GitHub"]},
      "status": "watch",
      "recommended_tier": "first-evaluate",
      "status_reason": "Research recommendation only; no local evaluation or installation by this workflow.",
      "pinned_version": null,
      "last_evaluated": null,
      "watch_paths": [],
      "verification": []
    },
    {
      "id": "pdfcraft",
      "name": "PdfCraft",
      "repository": "https://github.com/storytold/pdfcraft",
      "discovered_at": "2026-10-21T20:51:48Z",
      "discovery_sources": ["broad-audit"],
      "repository_created_at": null,
      "first_public_commit_at": null,
      "latest_functional_commit_at": null,
      "latest_release": {"version":null,"published_at":null},
      "upstream_or_parent": null,
      "license": null,
      "windows": {"build":true,"execution":null},
      "interfaces": {"cli":true,"mcp":true,"stdio":true,"json_rpc":null,"headless":true,"live_gui_attach":true},
      "agent_properties": {"inspectable_state":true,"render_feedback":true,"filesystem_scoping":true,"revision_guards":null,"rollback":true,"transactional_edits":true},
      "security": {"boundaries":["Reported stdio MCP with a narrow --root."],"concerns":["Forms, signatures, OCR and complex text need round-trip tests."]},
      "capability": {"category":"PDF","replaces":[],"incremental_value":"Persistent semantic PDF mutation and rendered feedback.","existing_routes":["PDF skill","PyMuPDF"]},
      "status": "watch",
      "recommended_tier": "first-evaluate",
      "status_reason": "Research recommendation only; no local evaluation or installation by this workflow.",
      "pinned_version": null,
      "last_evaluated": null,
      "watch_paths": [],
      "verification": []
    },
    {
      "id": "blender-agent-sdk",
      "name": "Blender Agent SDK",
      "repository": "https://github.com/yazzang-homelab/blender-agent-sdk",
      "discovered_at": "2026-10-21T20:51:48Z",
      "discovery_sources": ["emerging-audit"],
      "repository_created_at": null,
      "first_public_commit_at": null,
      "latest_functional_commit_at": null,
      "latest_release": {"version":null,"published_at":null},
      "upstream_or_parent": null,
      "license": "GPL-3.0",
      "windows": {"build":true,"execution":null},
      "interfaces": {"cli":true,"mcp":true,"stdio":true,"json_rpc":null,"headless":true,"live_gui_attach":true},
      "agent_properties": {"inspectable_state":true,"render_feedback":true,"filesystem_scoping":null,"revision_guards":null,"rollback":true,"transactional_edits":null},
      "security": {"boundaries":["Reported session-token loopback bridge."],"concerns":["Windows GUI execution untested by the report; benchmark against blender-mcp."]},
      "capability": {"category":"3D","replaces":[],"incremental_value":"Persistent scene inspection, property edits, checkpoints and renders.","existing_routes":["Blender CLI","media-tools"]},
      "status": "watch",
      "recommended_tier": "first-evaluate",
      "status_reason": "Research recommendation only; no local evaluation or installation by this workflow.",
      "pinned_version": null,
      "last_evaluated": null,
      "watch_paths": [],
      "verification": []
    },
    {
      "id": "blender-mcp",
      "name": "blender-mcp (sandraschi)",
      "repository": "https://github.com/sandraschi/blender-mcp",
      "discovered_at": "2026-10-21T20:51:48Z",
      "discovery_sources": ["conversation:6ad8ecad-6f4c-83eb-a574-58c427e57533"],
      "repository_created_at": null,
      "first_public_commit_at": null,
      "latest_functional_commit_at": null,
      "latest_release": {"version":null,"published_at":null},
      "upstream_or_parent": null,
      "license": null,
      "windows": {"build":null,"execution":null},
      "interfaces": {"cli":null,"mcp":true,"stdio":null,"json_rpc":null,"headless":true,"live_gui_attach":true},
      "agent_properties": {"inspectable_state":true,"render_feedback":true,"filesystem_scoping":null,"revision_guards":null,"rollback":null,"transactional_edits":null},
      "security": {"boundaries":["Use copied scenes and explicit local sessions."],"concerns":["Choose one Blender adapter after the shared ten-task benchmark."]},
      "capability": {"category":"3D","replaces":[],"incremental_value":"Headless Blender operations and optional live bridge; comparison candidate.","existing_routes":["Blender CLI","media-tools"]},
      "status": "watch",
      "recommended_tier": "first-evaluate",
      "status_reason": "Research recommendation only; no local evaluation or installation by this workflow.",
      "pinned_version": null,
      "last_evaluated": null,
      "watch_paths": [],
      "verification": []
    },
    {
      "id": "logisheets",
      "name": "LogiSheets",
      "repository": "https://github.com/logisky/LogiSheets",
      "discovered_at": "2026-10-21T20:51:48Z",
      "discovery_sources": ["broad-audit"],
      "repository_created_at": null,
      "first_public_commit_at": null,
      "latest_functional_commit_at": null,
      "latest_release": {"version":null,"published_at":null},
      "upstream_or_parent": null,
      "license": "MIT",
      "windows": {"build":true,"execution":null},
      "interfaces": {"cli":null,"mcp":true,"stdio":null,"json_rpc":null,"headless":true,"live_gui_attach":null},
      "agent_properties": {"inspectable_state":true,"render_feedback":null,"filesystem_scoping":null,"revision_guards":null,"rollback":null,"transactional_edits":null},
      "security": {"boundaries":["Reported semantic mutation policies."],"concerns":["Filesystem confinement not established; experimental desktop is not the integration target."]},
      "capability": {"category":"spreadsheets","replaces":[],"incremental_value":"Semantic Blocks, schemas and write policies beyond coordinate editing.","existing_routes":["spreadsheet skill","XLSX libraries"]},